{
  "$schema": "https://json-schema.org/draft/2020-12/schema",
  "$id": "https://www.schemastore.org/okf-0.2.json",
  "title": "OKF Knowledge Graph",
  "description": "JSON graph representation of an Open Knowledge Format (OKF) v0.2 bundle. Produced by the `okf graph` command.",
  "type": "object",
  "required": ["version", "nodes", "edges"],
  "properties": {
    "$schema": {
      "type": "string",
      "const": "https://www.schemastore.org/okf-0.2.json",
      "description": "JSON Schema identifier for this graph document. Published on SchemaStore."
    },
    "version": {
      "type": "string",
      "const": "0.2",
      "description": "Schema version of this OKF graph format."
    },
    "generated": {
      "$ref": "#/$defs/actorEvent",
      "description": "Who produced this graph file. The okf tool emits { by: \"okf/0.2\", at: <UTC now> }."
    },
    "timestamp": {
      "type": "string",
      "format": "date-time",
      "description": "UTC timestamp when the graph was generated. Same instant as generated.at."
    },
    "bundle": {
      "type": "object",
      "description": "Optional object containing custom properties passed via -p when generating the graph. Only present when such properties were provided.",
      "additionalProperties": true
    },
    "nav": {
      "$ref": "#/$defs/navNode",
      "description": "Index-driven navigation tree reflecting SPEC §8 directory indexes (and synthetic listings when index.md is missing). Present only when the graph was produced with --nav / includeNav. Producer contract: root node has kind \"dir\" and id \"\"; kind \"dir\" always includes body; empty group/orphans nodes are never emitted; directories never appear in nodes[]."
    },
    "nodes": {
      "type": "array",
      "description": "List of concept nodes in the knowledge graph.",
      "items": {
        "$ref": "#/$defs/node"
      }
    },
    "edges": {
      "type": "array",
      "description": "Directed edges representing links between concepts.",
      "items": {
        "$ref": "#/$defs/edge"
      }
    }
  },
  "additionalProperties": true,
  "$defs": {
    "actorEvent": {
      "type": "object",
      "description": "An actor and optional timestamp (generated.by / verified[].by). Actor convention: <producer>/<version>, human:<id>, process:<id>.",
      "properties": {
        "by": {
          "type": "string",
          "description": "Actor that performed the action."
        },
        "at": {
          "type": "string",
          "format": "date-time",
          "description": "When the action occurred."
        }
      },
      "additionalProperties": true
    },
    "usageWindow": {
      "type": "object",
      "description": "Date range framing usage_count signals.",
      "properties": {
        "from": { "type": "string", "format": "date" },
        "to": { "type": "string", "format": "date" }
      },
      "additionalProperties": true
    },
    "sourceEntry": {
      "type": "object",
      "description": "A provenance source (frontmatter sources[] or a legacy # Citations link).",
      "properties": {
        "id": { "type": "string" },
        "resource": { "type": "string" },
        "title": { "type": "string" },
        "author": { "type": "string" },
        "usageCount": { "type": "integer", "minimum": 0 },
        "lastModified": { "type": "string", "format": "date" },
        "usageWindow": { "$ref": "#/$defs/usageWindow" }
      },
      "additionalProperties": true
    },
    "computationParameter": {
      "type": "object",
      "properties": {
        "name": { "type": "string" },
        "type": { "type": "string" },
        "required": { "type": "boolean" }
      },
      "additionalProperties": true
    },
    "executorContract": {
      "type": "object",
      "properties": {
        "resource": { "type": "string" },
        "receipt": {
          "type": "array",
          "items": { "type": "string" }
        }
      },
      "additionalProperties": true
    },
    "attesterContract": {
      "type": "object",
      "properties": {
        "resource": { "type": "string" }
      },
      "additionalProperties": true
    },
    "node": {
      "type": "object",
      "description": "A knowledge concept node.",
      "required": ["id", "type"],
      "properties": {
        "id": {
          "type": "string",
          "description": "Unique identifier for the concept (path without .md extension)."
        },
        "slug": {
          "type": "string",
          "description": "Short unique slug for the node (e.g. 'f', 'fc', 'fl'). Computed for compact/URL-friendly references (e.g. #fragments). Stable for a given set of concepts."
        },
        "type": {
          "type": "string",
          "description": "The concept type from frontmatter (e.g. 'BigQuery Table', 'Reference', 'Attested Computation')."
        },
        "title": {
          "type": "string",
          "description": "Display title from frontmatter."
        },
        "description": {
          "type": "string",
          "description": "Short description from frontmatter."
        },
        "resource": {
          "type": "string",
          "description": "Canonical URI for the underlying resource, if any."
        },
        "tags": {
          "type": "array",
          "items": {
            "type": "string"
          },
          "description": "Tags from frontmatter."
        },
        "timestamp": {
          "type": "string",
          "format": "date-time",
          "description": "Last meaningful content change: generated.at when present, otherwise the legacy timestamp field."
        },
        "generated": {
          "$ref": "#/$defs/actorEvent",
          "description": "How the current concept content was produced (frontmatter generated)."
        },
        "verified": {
          "type": "array",
          "description": "Normalized list of verification events. A bare mapping in YAML is lifted to a one-element list.",
          "items": { "$ref": "#/$defs/actorEvent" }
        },
        "sources": {
          "type": "array",
          "description": "Provenance sources from frontmatter, or synthesized from a legacy # Citations heading.",
          "items": { "$ref": "#/$defs/sourceEntry" }
        },
        "usageWindow": {
          "$ref": "#/$defs/usageWindow",
          "description": "Shared usage window that frames sources[].usageCount."
        },
        "status": {
          "type": "string",
          "enum": ["draft", "stable", "deprecated"],
          "description": "Lifecycle status. Omitted when absent (consumers treat absent as stable)."
        },
        "staleAfter": {
          "type": "string",
          "format": "date",
          "description": "Absolute date (YYYY-MM-DD). Content is stale on or after this day."
        },
        "stale": {
          "type": "boolean",
          "description": "Derived at generate time: today >= staleAfter. Only present when staleAfter is set."
        },
        "trustTier": {
          "type": "string",
          "enum": ["unverified", "machine-confirmed", "human-reviewed"],
          "description": "Derived from verified per OKF §5.3. Always emitted."
        },
        "runtime": {
          "type": "string",
          "description": "Attested Computation runtime (e.g. bigquery, dbt, python)."
        },
        "parameters": {
          "type": "array",
          "items": { "$ref": "#/$defs/computationParameter" }
        },
        "computation": {
          "type": "string",
          "description": "Optional path to the computation file (when not inlined under # Computation)."
        },
        "executor": { "$ref": "#/$defs/executorContract" },
        "attester": { "$ref": "#/$defs/attesterContract" },
        "body": {
          "type": "string",
          "description": "Full markdown body (only present when --body / includeBody was used)."
        },
        "label": {
          "type": "string",
          "description": "Optional display label (falls back to derived values)."
        },
        "path": {
          "type": "string",
          "description": "Relative path to the source .md file within the bundle."
        },
        "degree": {
          "type": "integer",
          "minimum": 0,
          "description": "Total number of connected edges (in + out)."
        },
        "in": {
          "type": "integer",
          "minimum": 0,
          "description": "Number of incoming edges."
        },
        "out": {
          "type": "integer",
          "minimum": 0,
          "description": "Number of outgoing edges."
        },
        "weight": {
          "type": "number",
          "minimum": 0,
          "maximum": 1,
          "description": "PageRank weight (0-1)."
        },
        "rank": {
          "type": "integer",
          "minimum": 1,
          "description": "Rank order by weight."
        }
      },
      "additionalProperties": true
    },
    "edge": {
      "type": "object",
      "description": "A directed link from one concept to another.",
      "required": ["source", "target", "id"],
      "properties": {
        "source": {
          "type": "string",
          "description": "Source node id."
        },
        "target": {
          "type": "string",
          "description": "Target node id."
        },
        "id": {
          "type": "string",
          "description": "Short stable identifier for the edge."
        },
        "label": {
          "type": "string",
          "description": "Human-readable label for the edge (often link text or target title)."
        }
      },
      "additionalProperties": true
    },
    "navNode": {
      "type": "object",
      "description": "A node in the index-driven navigation tree. Directories are not concepts (reserved index.md).",
      "required": ["kind"],
      "properties": {
        "kind": {
          "type": "string",
          "enum": ["group", "dir", "concept", "orphans"],
          "description": "group/orphans are non-routeable grouping headers; dir and concept are navigable."
        },
        "id": {
          "type": "string",
          "description": "Concept id, or directory path relative to bundle root (empty string for root). Omitted for group and orphans."
        },
        "label": {
          "type": "string",
          "description": "Display label (index link text, section heading, or derived title)."
        },
        "description": {
          "type": "string",
          "description": "Optional short description from index entry or concept frontmatter."
        },
        "body": {
          "type": "string",
          "description": "Index markdown for kind=dir (authored after optional root frontmatter strip, or synthetic listing). Parallel to node.body."
        },
        "synthetic": {
          "type": "boolean",
          "description": "True when body/children were synthesized because index.md was missing."
        },
        "children": {
          "type": "array",
          "description": "Child nav nodes (groups, dirs, concepts, trailing orphans).",
          "items": {
            "$ref": "#/$defs/navNode"
          }
        }
      },
      "additionalProperties": true
    }
  }
}
