{
  "$schema": "https://www.schemastore.org/okf-0.2.json",
  "version": "0.2",
  "generated": {
    "by": "okf/0.2",
    "at": "2026-08-13T19:05:39.6660928+00:00"
  },
  "timestamp": "2026-08-13T19:05:39.6660928+00:00",
  "nav": {
    "kind": "dir",
    "id": "",
    "label": "Attested computations (v0.2)",
    "body": "# Attested computations (v0.2)\n\n* [Income statement](metrics/income-statement.md) - Narrative metric that links to attested figures\n* [Revenue](computations/revenue.md) - Human-reviewed BigQuery computation\n* [Gross profit](computations/profit.md) - Process-verified, past stale_after\n* [Legacy handbook note](metrics/legacy-handbook.md) - v0.1 timestamp + Citations fallback\n* [computations/](computations/) - Attested Computation concepts\n* [metrics/](metrics/) - Narrative metrics\n* [references/](references/) - Executor and attester stubs\n",
    "children": [
      {
        "kind": "dir",
        "id": "computations",
        "label": "computations/",
        "description": "Attested Computation concepts",
        "body": "# Computations\n\n* [Revenue](revenue.md) - Recognized revenue\n* [Gross profit](profit.md) - Gross profit by segment\n",
        "children": [
          {
            "kind": "concept",
            "id": "computations/revenue",
            "label": "Revenue",
            "description": "Recognized revenue"
          },
          {
            "kind": "concept",
            "id": "computations/profit",
            "label": "Gross profit",
            "description": "Gross profit by segment"
          }
        ]
      },
      {
        "kind": "dir",
        "id": "metrics",
        "label": "metrics/",
        "description": "Narrative metrics",
        "body": "# Metrics\n\n* [Income statement](income-statement.md) - Headline figures for a fiscal year\n* [Legacy handbook note](legacy-handbook.md) - v0.1-shaped concept\n",
        "children": [
          {
            "kind": "concept",
            "id": "metrics/income-statement",
            "label": "Income statement",
            "description": "Headline figures for a fiscal year"
          },
          {
            "kind": "concept",
            "id": "metrics/legacy-handbook",
            "label": "Legacy handbook note",
            "description": "v0.1-shaped concept"
          }
        ]
      },
      {
        "kind": "dir",
        "id": "references",
        "label": "references/",
        "description": "Executor and attester stubs",
        "body": "# References\n\n* [skills/](skills/) - Executor run instructions\n* [attesters/](attesters/) - Deterministic attesters\n",
        "children": [
          {
            "kind": "dir",
            "id": "references/skills",
            "label": "skills/",
            "description": "Executor run instructions",
            "body": "# Skills\n\n* [Run on BigQuery](run-on-bq.md) - Executor stub\n",
            "children": [
              {
                "kind": "concept",
                "id": "references/skills/run-on-bq",
                "label": "Run on BigQuery",
                "description": "Executor stub"
              }
            ]
          },
          {
            "kind": "dir",
            "id": "references/attesters",
            "label": "attesters/",
            "description": "Deterministic attesters",
            "body": "# Attesters\n\n* [SQL equality](sql-equality.md) - Deterministic SQL comparison stub\n",
            "children": [
              {
                "kind": "concept",
                "id": "references/attesters/sql-equality",
                "label": "SQL equality",
                "description": "Deterministic SQL comparison stub"
              }
            ]
          }
        ]
      }
    ]
  },
  "nodes": [
    {
      "id": "computations/profit",
      "slug": "cp",
      "type": "Attested Computation",
      "title": "Gross profit for fiscal year",
      "label": "Gross profit",
      "description": "Gross profit by segment for a fiscal year, per the cost-allocation standard.",
      "tags": [
        "finance",
        "profit"
      ],
      "timestamp": "2026-06-14T14:00:00+00:00",
      "generated": {
        "by": "grok-4.6",
        "at": "2026-06-14T14:00:00+00:00"
      },
      "verified": [
        {
          "by": "process:finance-nightly",
          "at": "2026-06-12T08:00:00+00:00"
        }
      ],
      "sources": [
        {
          "id": "cost-alloc",
          "resource": "https://wiki.acme/finance/cost-allocation",
          "title": "Cost allocation standard"
        }
      ],
      "status": "stable",
      "staleAfter": "2026-06-15",
      "stale": true,
      "trustTier": "machine-confirmed",
      "runtime": "dbt",
      "parameters": [
        {
          "name": "year",
          "type": "integer",
          "required": true
        },
        {
          "name": "segment",
          "type": "string",
          "required": true
        }
      ],
      "executor": {
        "resource": "/references/skills/run-on-bq.md",
        "receipt": [
          "run_id",
          "compiled_sql",
          "result"
        ]
      },
      "attester": {
        "resource": "/references/attesters/sql-equality.md"
      },
      "body": "# Computation\n\n    SELECT gross_profit\n    FROM {{ ref('fct_income_statement') }}\n    WHERE fiscal_year = {{ var('year') }}\n      AND segment = {{ var('segment') }}\n\nGross profit by segment per the cost-allocation standard.[^cost-alloc]\n\n[^cost-alloc]: Cost allocation standard\n",
      "path": "computations/profit.md",
      "degree": 1,
      "in": 1,
      "out": 0,
      "weight": 0.21208073889373213,
      "rank": 2
    },
    {
      "id": "computations/revenue",
      "slug": "cr",
      "type": "Attested Computation",
      "title": "Revenue for fiscal year",
      "label": "Revenue",
      "description": "Recognized revenue for a fiscal year, per Finance's definition.",
      "tags": [
        "finance",
        "revenue"
      ],
      "timestamp": "2026-06-28T14:00:00+00:00",
      "generated": {
        "by": "grok-4.6",
        "at": "2026-06-28T14:00:00+00:00"
      },
      "verified": [
        {
          "by": "human:ahormati",
          "at": "2026-06-25T09:00:00+00:00"
        }
      ],
      "sources": [
        {
          "id": "rev-policy",
          "resource": "https://wiki.acme/finance/revenue-recognition",
          "title": "Revenue recognition policy",
          "author": "team:finance-fpa",
          "lastModified": "2026-04-02"
        }
      ],
      "status": "stable",
      "staleAfter": "2099-12-31",
      "stale": false,
      "trustTier": "human-reviewed",
      "runtime": "bigquery",
      "parameters": [
        {
          "name": "year",
          "type": "integer",
          "required": true
        }
      ],
      "executor": {
        "resource": "/references/skills/run-on-bq.md",
        "receipt": [
          "job_id",
          "executed_sql",
          "result"
        ]
      },
      "attester": {
        "resource": "/references/attesters/sql-equality.md"
      },
      "body": "# Computation\n\n    SELECT SUM(amount) AS revenue\n    FROM finance.recognized_revenue\n    WHERE fiscal_year = @year\n\nRecognized revenue per the recognition policy.[^rev-policy]\n\n[^rev-policy]: Revenue recognition policy\n",
      "path": "computations/revenue.md",
      "degree": 1,
      "in": 1,
      "out": 0,
      "weight": 0.21208073889373213,
      "rank": 2
    },
    {
      "id": "metrics/income-statement",
      "slug": "mi",
      "type": "Metric",
      "title": "Income statement (fiscal year)",
      "label": "Income statement",
      "description": "Headline income-statement figures for a fiscal year.",
      "tags": [
        "finance",
        "income-statement"
      ],
      "timestamp": "2026-06-20T22:53:05+00:00",
      "generated": {
        "by": "grok-4.6",
        "at": "2026-06-20T22:53:05+00:00"
      },
      "verified": [
        {
          "by": "process:finance-nightly",
          "at": "2026-06-24T02:00:00+00:00"
        },
        {
          "by": "human:ahormati",
          "at": "2026-06-25T09:00:00+00:00"
        }
      ],
      "sources": [
        {
          "id": "fpa-handbook",
          "resource": "https://wiki.acme/finance/fpa-handbook",
          "title": "FP&A reporting handbook"
        }
      ],
      "status": "stable",
      "staleAfter": "2099-12-31",
      "stale": false,
      "trustTier": "human-reviewed",
      "body": "# Definition\n\nThe income statement reports [revenue](../computations/revenue.md) and\n[gross profit](../computations/profit.md) for a fiscal year, per the FP&A\nreporting handbook.[^fpa-handbook]\n\n[^fpa-handbook]: FP&A reporting handbook\n",
      "path": "metrics/income-statement.md",
      "degree": 3,
      "in": 1,
      "out": 2,
      "weight": 0.21964978081602143,
      "rank": 1
    },
    {
      "id": "metrics/legacy-handbook",
      "slug": "ml",
      "type": "Reference",
      "title": "FP&A handbook (legacy note)",
      "label": "Legacy handbook note",
      "description": "v0.1-shaped concept kept to lock timestamp and Citations fallbacks.",
      "tags": [
        "finance",
        "legacy"
      ],
      "timestamp": "2026-05-28T14:30:00+00:00",
      "sources": [
        {
          "resource": "https://wiki.acme/finance/fpa-handbook",
          "title": "FP&A reporting handbook"
        }
      ],
      "trustTier": "unverified",
      "body": "See the [income statement](income-statement.md) for the current narrative.\n\n# Citations\n\n[1] [FP&A reporting handbook](https://wiki.acme/finance/fpa-handbook)\n",
      "path": "metrics/legacy-handbook.md",
      "degree": 1,
      "in": 0,
      "out": 1,
      "weight": 0.1187295804655048,
      "rank": 4
    },
    {
      "id": "references/attesters/sql-equality",
      "slug": "ras",
      "type": "Reference",
      "title": "SQL equality attester",